{
  "schemaVersion": 1,
  "id": "runefall-base",
  "version": "0.1.0",
  "name": "Runefall base content",
  "description": "Base ladder and balance content migrated from the POC CSV tables.",
  "content": [
    {
      "entity": "stageLadder",
      "file": "data/stage_ladder.json"
    },
    {
      "entity": "tierDefinitions",
      "file": "data/tier_definitions.json"
    },
    {
      "entity": "curveProfiles",
      "file": "data/curve_profiles.json"
    },
    {
      "entity": "difficultyProfiles",
      "file": "data/difficulty_profiles.json"
    },
    {
      "entity": "assignmentRules",
      "file": "data/stage_assignment_rules.json"
    },
    {
      "entity": "contentBands",
      "file": "data/stage_content_bands.json"
    },
    {
      "entity": "legacyTierMap",
      "file": "data/legacy_rf_tier_map.json"
    },
    {
      "entity": "roles",
      "file": "data/roles.json"
    },
    {
      "entity": "raceProfiles",
      "file": "data/race_profiles.json"
    },
    {
      "entity": "raceClassificationRules",
      "file": "data/race_classification_rules.json"
    },
    {
      "entity": "threatProtection",
      "file": "data/threat_protection.json"
    },
    {
      "entity": "enemyPackages",
      "file": "data/enemy_packages.json"
    },
    {
      "entity": "equipmentSets",
      "file": "data/equipment_sets.json"
    },
    {
      "entity": "playerProgression",
      "file": "data/player_progression.json"
    },
    {
      "entity": "ratingProfiles",
      "file": "data/rating_profiles.json"
    },
    {
      "entity": "combatPaceProfiles",
      "file": "data/combat_pace_profiles.json"
    },
    {
      "entity": "ratingDisplayProfiles",
      "file": "data/rating_display_profiles.json"
    }
  ],
  "localization": []
}
